{
  "schema_version": "1.0.0",
  "artifact_id": "offer-pickfu-20260405",
  "artifact_type": "offer",
  "created_at": "2026-04-05T10:15:00Z",
  "source_system": "BonfyreOffer",
  "tags": ["founder", "pickfu", "offer"],
  "root_hash": "",
  "atoms": [
    {
      "atom_id": "proof-bundle-json",
      "content_hash": "3300aabb4455667788990011aabbccddeeff22334455667788990011aabbccdd",
      "media_type": "application/json",
      "path": "source/proof-bundle.json",
      "byte_size": 1800,
      "label": "Proof bundle from BonfyreProof"
    }
  ],
  "operators": [
    {
      "operator_id": "op-offer-generate",
      "op": "OfferGenerate",
      "inputs": ["proof-bundle-json"],
      "output": "offer-json",
      "params": {
        "tool": "BonfyreOffer",
        "headline": "Local-first proof-backed deliverables",
        "price_usd": 18,
        "turnaround": "same day for short files"
      },
      "version": "1.0.0",
      "deterministic": true
    },
    {
      "operator_id": "op-offer-md",
      "op": "OfferReadable",
      "inputs": ["offer-json"],
      "output": "offer-md",
      "params": {},
      "version": "1.0.0",
      "deterministic": true
    },
    {
      "operator_id": "op-outreach",
      "op": "OutreachGenerate",
      "inputs": ["offer-json"],
      "output": "outreach-md",
      "params": {},
      "version": "1.0.0",
      "deterministic": true
    }
  ],
  "realizations": [
    {
      "realization_id": "offer-json",
      "media_type": "application/json",
      "path": "outputs/offer.json",
      "content_hash": "5500aabb6677889900112233aabbccddeeff44556677889900112233aabbccdd",
      "byte_size": 920,
      "pinned": true,
      "produced_by": "op-offer-generate",
      "label": "Offer JSON"
    },
    {
      "realization_id": "offer-md",
      "media_type": "text/markdown",
      "path": "outputs/offer.md",
      "content_hash": "6600aabb7788990011223344aabbccddeeff55667788990011223344aabbccdd",
      "byte_size": 1400,
      "pinned": true,
      "produced_by": "op-offer-md",
      "label": "Offer readable"
    },
    {
      "realization_id": "outreach-md",
      "media_type": "text/markdown",
      "path": "outputs/outreach.md",
      "content_hash": "7700aabb8899001122334455aabbccddeeff66778899001122334455aabbccdd",
      "byte_size": 600,
      "pinned": true,
      "produced_by": "op-outreach",
      "label": "Outreach message"
    }
  ],
  "realization_targets": [
    {
      "target_id": "narrated-offer",
      "media_type": "audio/wav",
      "op": "Narrate",
      "params": {"profile": "offer_pitch", "voice": "en_US-lessac-medium"},
      "description": "Spoken offer pitch"
    }
  ],
  "metadata": {
    "price_usd": 18,
    "turnaround": "same day for short files"
  }
}
